[2026-02-13 13:56:42] ======================================================================
[2026-02-13 13:56:42] DAILY SCRAPER - Starting Update
[2026-02-13 13:56:42] ======================================================================
[2026-02-13 13:56:42] 
📊 Found 84 players to update
[2026-02-13 13:56:42] 
[1/84] Updating Aaron Judge...
[2026-02-13 13:56:43]    ✅ Updated Aaron Judge
[2026-02-13 13:56:43]    🚨 2 new alert(s)
[2026-02-13 13:56:45] 
[2/84] Updating Adley Rutschman...
[2026-02-13 13:56:45]    ✅ Updated Adley Rutschman
[2026-02-13 13:56:47] 
[3/84] Updating Adley Rutschman...
[2026-02-13 13:56:47]    ✅ Updated Adley Rutschman
[2026-02-13 13:56:49] 
[4/84] Updating Anthony Santander...
[2026-02-13 13:56:50]    ✅ Updated Anthony Santander
[2026-02-13 13:56:50]    🚨 1 new alert(s)
[2026-02-13 13:56:52] 
[5/84] Updating Anthony Santander...
[2026-02-13 13:56:52]    ✅ Updated Anthony Santander
[2026-02-13 13:56:52]    🚨 1 new alert(s)
[2026-02-13 13:56:54] 
[6/84] Updating Austin Riley...
[2026-02-13 13:56:54]    ✅ Updated Austin Riley
[2026-02-13 13:56:54]    🚨 1 new alert(s)
[2026-02-13 13:56:56] 
[7/84] Updating Austin Riley...
[2026-02-13 13:56:57]    ✅ Updated Austin Riley
[2026-02-13 13:56:57]    🚨 1 new alert(s)
[2026-02-13 13:56:59] 
[8/84] Updating Bobby Witt Jr....
[2026-02-13 13:56:59]    ✅ Updated Bobby Witt Jr.
[2026-02-13 13:57:01] 
[9/84] Updating Bobby Witt Jr....
[2026-02-13 13:57:01]    ✅ Updated Bobby Witt Jr.
[2026-02-13 13:57:03] 
[10/84] Updating Bryan Reynolds...
[2026-02-13 13:57:04]    ✅ Updated Bryan Reynolds
[2026-02-13 13:57:06] 
[11/84] Updating Bryan Reynolds...
[2026-02-13 13:57:06]    ✅ Updated Bryan Reynolds
[2026-02-13 13:57:08] 
[12/84] Updating Cal Raleigh...
[2026-02-13 13:57:08]    ✅ Updated Cal Raleigh
[2026-02-13 13:57:08]    🚨 1 new alert(s)
[2026-02-13 13:57:10] 
[13/84] Updating Cal Raleigh...
[2026-02-13 13:57:11]    ✅ Updated Cal Raleigh
[2026-02-13 13:57:11]    🚨 1 new alert(s)
[2026-02-13 13:57:13] 
[14/84] Updating Cedric Mullins...
[2026-02-13 13:57:13]    ✅ Updated Cedric Mullins
[2026-02-13 13:57:15] 
[15/84] Updating Cedric Mullins...
[2026-02-13 13:57:15]    ✅ Updated Cedric Mullins
[2026-02-13 13:57:17] 
[16/84] Updating Christian Yelich...
[2026-02-13 13:57:17]    ✅ Updated Christian Yelich
[2026-02-13 13:57:20] 
[17/84] Updating Corbin Carroll...
[2026-02-13 13:57:20]    ✅ Updated Corbin Carroll
[2026-02-13 13:57:20]    🚨 1 new alert(s)
[2026-02-13 13:57:22] 
[18/84] Updating Corbin Carroll...
[2026-02-13 13:57:22]    ✅ Updated Corbin Carroll
[2026-02-13 13:57:22]    🚨 1 new alert(s)
[2026-02-13 13:57:24] 
[19/84] Updating Corey Seager...
[2026-02-13 13:57:24]    ✅ Updated Corey Seager
[2026-02-13 13:57:26] 
[20/84] Updating Corey Seager...
[2026-02-13 13:57:26]    ✅ Updated Corey Seager
[2026-02-13 13:57:28] 
[21/84] Updating Dansby Swanson...
[2026-02-13 13:57:29]    ✅ Updated Dansby Swanson
[2026-02-13 13:57:29]    🚨 1 new alert(s)
[2026-02-13 13:57:31] 
[22/84] Updating Dansby Swanson...
[2026-02-13 13:57:31]    ✅ Updated Dansby Swanson
[2026-02-13 13:57:31]    🚨 1 new alert(s)
[2026-02-13 13:57:33] 
[23/84] Updating Fernando Tatis Jr....
[2026-02-13 13:57:34]    ✅ Updated Fernando Tatis Jr.
[2026-02-13 13:57:34]    🚨 1 new alert(s)
[2026-02-13 13:57:36] 
[24/84] Updating Fernando Tatis Jr....
[2026-02-13 13:57:36]    ✅ Updated Fernando Tatis Jr.
[2026-02-13 13:57:36]    🚨 1 new alert(s)
[2026-02-13 13:57:38] 
[25/84] Updating Francisco Lindor...
[2026-02-13 13:57:38]    ✅ Updated Francisco Lindor
[2026-02-13 13:57:40] 
[26/84] Updating Freddie Freeman...
[2026-02-13 13:57:40]    ✅ Updated Freddie Freeman
[2026-02-13 13:57:42] 
[27/84] Updating George Springer...
[2026-02-13 13:57:43]    ✅ Updated George Springer
[2026-02-13 13:57:43]    🚨 1 new alert(s)
[2026-02-13 13:57:45] 
[28/84] Updating George Springer...
[2026-02-13 13:57:45]    ✅ Updated George Springer
[2026-02-13 13:57:45]    🚨 1 new alert(s)
[2026-02-13 13:57:47] 
[29/84] Updating Giancarlo Stanton...
[2026-02-13 13:57:47]    ✅ Updated Giancarlo Stanton
[2026-02-13 13:57:47]    🚨 1 new alert(s)
[2026-02-13 13:57:49] 
[30/84] Updating Gleyber Torres...
[2026-02-13 13:57:50]    ✅ Updated Gleyber Torres
[2026-02-13 13:57:52] 
[31/84] Updating Gleyber Torres...
[2026-02-13 13:57:52]    ✅ Updated Gleyber Torres
[2026-02-13 13:57:54] 
[32/84] Updating Harrison Bader...
[2026-02-13 13:57:54]    ✅ Updated Harrison Bader
[2026-02-13 13:57:54]    🚨 1 new alert(s)
[2026-02-13 13:57:56] 
[33/84] Updating Ian Happ...
[2026-02-13 13:57:56]    ✅ Updated Ian Happ
[2026-02-13 13:57:58] 
[34/84] Updating Ian Happ...
[2026-02-13 13:57:59]    ✅ Updated Ian Happ
[2026-02-13 13:58:01] 
[35/84] Updating Jazz Chisholm Jr....
[2026-02-13 13:58:01]    ✅ Updated Jazz Chisholm Jr.
[2026-02-13 13:58:03] 
[36/84] Updating Jazz Chisholm Jr....
[2026-02-13 13:58:04]    ✅ Updated Jazz Chisholm Jr.
[2026-02-13 13:58:06] 
[37/84] Updating Jesse Winker...
[2026-02-13 13:58:06]    ✅ Updated Jesse Winker
[2026-02-13 13:58:06]    🚨 1 new alert(s)
[2026-02-13 13:58:08] 
[38/84] Updating Jesse Winker...
[2026-02-13 13:58:08]    ✅ Updated Jesse Winker
[2026-02-13 13:58:08]    🚨 1 new alert(s)
[2026-02-13 13:58:10] 
[39/84] Updating Jose Altuve...
[2026-02-13 13:58:10]    ✅ Updated Jose Altuve
[2026-02-13 13:58:10]    🚨 1 new alert(s)
[2026-02-13 13:58:12] 
[40/84] Updating Jose Ramirez...
[2026-02-13 13:58:13]    ✅ Updated Jose Ramirez
[2026-02-13 13:58:15] 
[41/84] Updating J.T. Realmuto...
[2026-02-13 13:58:15]    ✅ Updated J.T. Realmuto
[2026-02-13 13:58:15]    🚨 1 new alert(s)
[2026-02-13 13:58:17] 
[42/84] Updating Juan Soto...
[2026-02-13 13:58:17]    ✅ Updated Juan Soto
[2026-02-13 13:58:19] 
[43/84] Updating Juan Soto...
[2026-02-13 13:58:19]    ✅ Updated Juan Soto
[2026-02-13 13:58:21] 
[44/84] Updating Julio Rodriguez...
[2026-02-13 13:58:22]    ✅ Updated Julio Rodriguez
[2026-02-13 13:58:22]    🚨 1 new alert(s)
[2026-02-13 13:58:24] 
[45/84] Updating Julio Rodriguez...
[2026-02-13 13:58:24]    ✅ Updated Julio Rodriguez
[2026-02-13 13:58:24]    🚨 1 new alert(s)
[2026-02-13 13:58:26] 
[46/84] Updating Ketel Marte...
[2026-02-13 13:58:26]    ✅ Updated Ketel Marte
[2026-02-13 13:58:26]    🚨 1 new alert(s)
[2026-02-13 13:58:28] 
[47/84] Updating Ketel Marte...
[2026-02-13 13:58:28]    ✅ Updated Ketel Marte
[2026-02-13 13:58:28]    🚨 1 new alert(s)
[2026-02-13 13:58:30] 
[48/84] Updating Kris Bryant...
[2026-02-13 13:58:31]    ✅ Updated Kris Bryant
[2026-02-13 13:58:31]    🚨 2 new alert(s)
[2026-02-13 13:58:33] 
[49/84] Updating Kyle Schwarber...
[2026-02-13 13:58:33]    ✅ Updated Kyle Schwarber
[2026-02-13 13:58:35] 
[50/84] Updating Kyle Schwarber...
[2026-02-13 13:58:35]    ✅ Updated Kyle Schwarber
[2026-02-13 13:58:37] 
[51/84] Updating Kyle Tucker...
[2026-02-13 13:58:37]    ✅ Updated Kyle Tucker
[2026-02-13 13:58:39] 
[52/84] Updating Kyle Tucker...
[2026-02-13 13:58:40]    ✅ Updated Kyle Tucker
[2026-02-13 13:58:42] 
[53/84] Updating Marcus Semien...
[2026-02-13 13:58:42]    ✅ Updated Marcus Semien
[2026-02-13 13:58:42]    🚨 2 new alert(s)
[2026-02-13 13:58:44] 
[54/84] Updating Marcus Semien...
[2026-02-13 13:58:44]    ✅ Updated Marcus Semien
[2026-02-13 13:58:44]    🚨 2 new alert(s)
[2026-02-13 13:58:46] 
[55/84] Updating Matt Olson...
[2026-02-13 13:58:46]    ✅ Updated Matt Olson
[2026-02-13 13:58:46]    🚨 2 new alert(s)
[2026-02-13 13:58:48] 
[56/84] Updating Matt Olson...
[2026-02-13 13:58:49]    ✅ Updated Matt Olson
[2026-02-13 13:58:49]    🚨 2 new alert(s)
[2026-02-13 13:58:51] 
[57/84] Updating Michael Harris II...
[2026-02-13 13:58:51]    ✅ Updated Michael Harris II
[2026-02-13 13:58:51]    🚨 1 new alert(s)
[2026-02-13 13:58:53] 
[58/84] Updating Michael Harris II...
[2026-02-13 13:58:53]    ✅ Updated Michael Harris II
[2026-02-13 13:58:53]    🚨 1 new alert(s)
[2026-02-13 13:58:55] 
[59/84] Updating Mike Trout...
[2026-02-13 13:58:55]    ✅ Updated Mike Trout
[2026-02-13 13:58:55]    🚨 1 new alert(s)
[2026-02-13 13:58:57] 
[60/84] Updating Mookie Betts...
[2026-02-13 13:58:58]    ✅ Updated Mookie Betts
[2026-02-13 13:58:58]    🚨 2 new alert(s)
[2026-02-13 13:59:00] 
[61/84] Updating Nolan Arenado...
[2026-02-13 13:59:00]    ✅ Updated Nolan Arenado
[2026-02-13 13:59:00]    🚨 2 new alert(s)
[2026-02-13 13:59:02] 
[62/84] Updating Ozzie Albies...
[2026-02-13 13:59:02]    ✅ Updated Ozzie Albies
[2026-02-13 13:59:02]    🚨 2 new alert(s)
[2026-02-13 13:59:04] 
[63/84] Updating Ozzie Albies...
[2026-02-13 13:59:05]    ✅ Updated Ozzie Albies
[2026-02-13 13:59:05]    🚨 2 new alert(s)
[2026-02-13 13:59:07] 
[64/84] Updating Paul Goldschmidt...
[2026-02-13 13:59:07]    ✅ Updated Paul Goldschmidt
[2026-02-13 13:59:07]    🚨 1 new alert(s)
[2026-02-13 13:59:09] 
[65/84] Updating Paul Goldschmidt...
[2026-02-13 13:59:09]    ✅ Updated Paul Goldschmidt
[2026-02-13 13:59:09]    🚨 1 new alert(s)
[2026-02-13 13:59:11] 
[66/84] Updating Pete Alonso...
[2026-02-13 13:59:11]    ✅ Updated Pete Alonso
[2026-02-13 13:59:12]    🚨 1 new alert(s)
[2026-02-13 13:59:14] 
[67/84] Updating Rafael Devers...
[2026-02-13 13:59:14]    ✅ Updated Rafael Devers
[2026-02-13 13:59:16] 
[68/84] Updating Randy Arozarena...
[2026-02-13 13:59:16]    ✅ Updated Randy Arozarena
[2026-02-13 13:59:18] 
[69/84] Updating Randy Arozarena...
[2026-02-13 13:59:18]    ✅ Updated Randy Arozarena
[2026-02-13 13:59:20] 
[70/84] Updating Ronald Acuna Jr....
[2026-02-13 13:59:20]    ✅ Updated Ronald Acuna Jr.
[2026-02-13 13:59:22] 
[71/84] Updating Salvador Perez...
[2026-02-13 13:59:23]    ✅ Updated Salvador Perez
[2026-02-13 13:59:23]    🚨 1 new alert(s)
[2026-02-13 13:59:25] 
[72/84] Updating Salvador Perez...
[2026-02-13 13:59:25]    ✅ Updated Salvador Perez
[2026-02-13 13:59:25]    🚨 1 new alert(s)
[2026-02-13 13:59:27] 
[73/84] Updating Shohei Ohtani...
[2026-02-13 13:59:27]    ✅ Updated Shohei Ohtani
[2026-02-13 13:59:27]    🚨 1 new alert(s)
[2026-02-13 13:59:29] 
[74/84] Updating Steven Kwan...
[2026-02-13 13:59:30]    ✅ Updated Steven Kwan
[2026-02-13 13:59:32] 
[75/84] Updating Steven Kwan...
[2026-02-13 13:59:32]    ✅ Updated Steven Kwan
[2026-02-13 13:59:34] 
[76/84] Updating Teoscar Hernandez...
[2026-02-13 13:59:34]    ✅ Updated Teoscar Hernandez
[2026-02-13 13:59:34]    🚨 1 new alert(s)
[2026-02-13 13:59:36] 
[77/84] Updating Teoscar Hernandez...
[2026-02-13 13:59:36]    ✅ Updated Teoscar Hernandez
[2026-02-13 13:59:36]    🚨 1 new alert(s)
[2026-02-13 13:59:38] 
[78/84] Updating Trea Turner...
[2026-02-13 13:59:39]    ✅ Updated Trea Turner
[2026-02-13 13:59:41] 
[79/84] Updating Trea Turner...
[2026-02-13 13:59:41]    ✅ Updated Trea Turner
[2026-02-13 13:59:43] 
[80/84] Updating Vladimir Guerrero Jr....
[2026-02-13 13:59:43]    ✅ Updated Vladimir Guerrero Jr.
[2026-02-13 13:59:45] 
[81/84] Updating Will Smith...
[2026-02-13 13:59:45]    ✅ Updated Will Smith
[2026-02-13 13:59:45]    🚨 1 new alert(s)
[2026-02-13 13:59:47] 
[82/84] Updating Will Smith...
[2026-02-13 13:59:48]    ✅ Updated Will Smith
[2026-02-13 13:59:48]    🚨 1 new alert(s)
[2026-02-13 13:59:50] 
[83/84] Updating Yordan Alvarez...
[2026-02-13 13:59:50]    ✅ Updated Yordan Alvarez
[2026-02-13 13:59:52] 
[84/84] Updating Yordan Alvarez...
[2026-02-13 13:59:52]    ✅ Updated Yordan Alvarez
[2026-02-13 13:59:52] 
======================================================================
[2026-02-13 13:59:52] DAILY SCRAPER - Summary
[2026-02-13 13:59:52] ======================================================================
[2026-02-13 13:59:52] ✅ Successfully updated: 84/84
[2026-02-13 13:59:52] 🚨 New alerts detected: 57
[2026-02-13 13:59:52] ❌ Errors: 0
[2026-02-13 13:59:52] 
 Results saved to daily_update_20260213.json
